{
  "adopter_workflow": [
    {
      "command": "marked-bench --validate-conformance-report conformance/marked_bench_conformance_v0_4_6.json",
      "name": "pin_release",
      "output": "Release conformance validation passes.",
      "step": 1
    },
    {
      "command": "marked-bench --suite contradiction-multihop --export-prediction-template artifacts/multihop-predictions.jsonl",
      "name": "export_predictions",
      "output": "A JSONL prediction template with stable public case IDs.",
      "step": 2
    },
    {
      "command": "marked-bench --suite contradiction-multihop --score-predictions artifacts/multihop-predictions.jsonl --system-name \"SYSTEM\" --report artifacts/system-report.json",
      "name": "score_system",
      "output": "A validated benchmark report tied to the pinned suite hash.",
      "step": 3
    },
    {
      "command": "marked-bench --create-submission artifacts/system-submission.json --submission-report artifacts/system-report.json --system-version \"VERSION\" --submitter \"SUBMITTER\"",
      "name": "create_submission",
      "output": "Submission metadata with method disclosures and report hash evidence.",
      "step": 4
    },
    {
      "command": "marked-bench --create-submission-bundle artifacts/system-bundle.json --bundle-submission artifacts/system-submission.json",
      "name": "bundle_submission",
      "output": "A portable submission bundle for review.",
      "step": 5
    },
    {
      "command": "marked-bench --create-result-card artifacts/system-result-card.json --result-report artifacts/system-report.json --result-bundle artifacts/system-bundle.json",
      "name": "publish_result_card",
      "output": "A standard result card suitable for citation or leaderboard review.",
      "step": 6
    },
    {
      "command": "marked-bench --create-publication-packet artifacts/system-publication-packet --publication-report artifacts/system-report.json --publication-predictions artifacts/multihop-predictions.jsonl --system-version \"VERSION\" --submitter \"SUBMITTER\"",
      "name": "create_publication_packet",
      "output": "A self-contained public result packet with report, submission, bundle, review, result card, and hashes.",
      "step": 7
    },
    {
      "command": "marked-bench --create-result-claim artifacts/system-publication-packet/result_claim.json --claim-publication-packet artifacts/system-publication-packet/publication_packet.json",
      "name": "create_result_claim",
      "output": "A citeable result claim with exact score wording and overclaim boundaries.",
      "step": 8
    }
  ],
  "announcement_assets": [
    {
      "audience": "researchers",
      "path": "docs/ANNOUNCEMENT_PACKAGE.md",
      "purpose": "Release summary, citation wording, and reproducibility checklist."
    },
    {
      "audience": "implementers",
      "path": "docs/ADOPTION_GUIDE.md",
      "purpose": "Commands for scoring external systems and creating result cards."
    },
    {
      "audience": "reviewers",
      "path": "docs/SUBMISSION_REVIEW_RUBRIC.md",
      "purpose": "Review criteria before leaderboard acceptance."
    },
    {
      "audience": "maintainers",
      "path": "docs/THIRD_PARTY_EVIDENCE.md",
      "purpose": "Rules for verifying external adoption evidence without overstating claims."
    }
  ],
  "benchmark_family": "contradiction-detection",
  "citation": {
    "path": "CITATION.cff",
    "preferred_name": "The Marked Bench",
    "required_fields": [
      "release_tag",
      "suite_id",
      "suite_version",
      "suite_hash",
      "result_card_path",
      "result_claim_path"
    ]
  },
  "conformance_report_path": "conformance/marked_bench_conformance_v0_4_6.json",
  "default_track": "contradiction-multihop",
  "project": "The Marked Bench",
  "release_id": "marked-bench-contradiction-standard-release-0.4.6",
  "release_manifest_path": "releases/marked_bench_release_v0_4_6.json",
  "release_url": "https://github.com/Martin123132/The-Marked-Bench-/releases/tag/v0.4.6",
  "repository_url": "https://github.com/Martin123132/The-Marked-Bench-",
  "required_public_artifacts": [
    {
      "name": "registry",
      "path": "benchmark_registry.json",
      "purpose": "Machine-readable index of tracks, schemas, and commands."
    },
    {
      "name": "release_manifest",
      "path": "releases/marked_bench_release_v0_4_6.json",
      "purpose": "SHA-256 pinning for public release files."
    },
    {
      "name": "conformance_report",
      "path": "conformance/marked_bench_conformance_v0_4_6.json",
      "purpose": "Machine-readable pass/fail evidence for the release package."
    },
    {
      "name": "adoption_packet",
      "path": "adoption/marked_bench_adoption_packet_v0_4_6.json",
      "purpose": "Machine-readable packet for external users, mirrors, and announcements."
    },
    {
      "name": "third_party_evidence_ledger",
      "path": "adoption/third_party_evidence_ledger_v0_4_6.json",
      "purpose": "Checked ledger for external adoption evidence and verification status."
    },
    {
      "name": "implementation_kit",
      "path": "adoption/marked_bench_implementation_kit_v0_4_6.json",
      "purpose": "Machine-readable kit for external CI adoption and result validation."
    },
    {
      "name": "standard_profile",
      "path": "standard/marked_bench_standard_profile_v0_4_6.json",
      "purpose": "Machine-readable benchmark standard requirement matrix."
    },
    {
      "name": "scoring_compatibility",
      "path": "standard/marked_bench_scoring_compatibility_v0_4_6.json",
      "purpose": "Deterministic scoring vectors for external implementations."
    },
    {
      "name": "scoring_spec",
      "path": "standard/marked_bench_scoring_spec_v0_4_6.json",
      "purpose": "Language-neutral scoring contract for independent implementations."
    },
    {
      "name": "scoring_spec_doc",
      "path": "docs/SCORING_SPEC.md",
      "purpose": "Human-readable scoring contract."
    },
    {
      "name": "technical_note",
      "path": "docs/TECHNICAL_NOTE.md",
      "purpose": "Generated suite hashes, baselines, and limitations."
    },
    {
      "name": "adoption_guide",
      "path": "docs/ADOPTION_GUIDE.md",
      "purpose": "External user workflow for scoring and submitting systems."
    },
    {
      "name": "announcement_package",
      "path": "docs/ANNOUNCEMENT_PACKAGE.md",
      "purpose": "Copy-ready public launch and citation material."
    },
    {
      "name": "third_party_evidence",
      "path": "docs/THIRD_PARTY_EVIDENCE.md",
      "purpose": "Evidence rules for adoption claims."
    },
    {
      "name": "result_card_schema",
      "path": "schemas/result_card.schema.json",
      "purpose": "Schema for publishable benchmark result cards."
    },
    {
      "name": "publication_packet_schema",
      "path": "schemas/publication_packet.schema.json",
      "purpose": "Schema for one-command public result packets."
    },
    {
      "name": "result_claim_schema",
      "path": "schemas/result_claim.schema.json",
      "purpose": "Schema for citeable result claims tied to publication packet hashes."
    },
    {
      "name": "adoption_packet_schema",
      "path": "schemas/adoption_packet.schema.json",
      "purpose": "Schema for this adoption packet."
    },
    {
      "name": "implementation_kit_schema",
      "path": "schemas/implementation_kit.schema.json",
      "purpose": "Schema for external implementation kit descriptors."
    },
    {
      "name": "standard_profile_schema",
      "path": "schemas/standard_profile.schema.json",
      "purpose": "Schema for benchmark standard profiles."
    },
    {
      "name": "scoring_compatibility_schema",
      "path": "schemas/scoring_compatibility.schema.json",
      "purpose": "Schema for deterministic scoring compatibility vectors."
    },
    {
      "name": "scoring_spec_schema",
      "path": "schemas/scoring_spec.schema.json",
      "purpose": "Schema for the language-neutral scoring contract."
    },
    {
      "name": "third_party_evidence_schema",
      "path": "schemas/third_party_evidence_ledger.schema.json",
      "purpose": "Schema for external adoption evidence ledgers."
    },
    {
      "name": "checked_result_card",
      "path": "submissions/example_external_jsonl/example_external_result_card.json",
      "purpose": "Example result card with report, bundle, review, and hash evidence."
    },
    {
      "name": "checked_publication_packet",
      "path": "submissions/example_publication_packet/publication_packet.json",
      "purpose": "Example one-command public result packet with copied report and complete evidence chain."
    },
    {
      "name": "checked_result_claim",
      "path": "submissions/example_publication_packet/result_claim.json",
      "purpose": "Example citeable result claim with exact wording, boundaries, and evidence hashes."
    },
    {
      "name": "implementation_kit_guide",
      "path": "adoption/implementation_kit/README.md",
      "purpose": "Copy-ready instructions for external repositories adopting the benchmark."
    },
    {
      "name": "implementation_kit_ci",
      "path": "adoption/implementation_kit/github_actions_validate_result.yml",
      "purpose": "Copy-ready GitHub Actions workflow for validating publication packets and result claims."
    },
    {
      "name": "implementation_kit_badge",
      "path": "adoption/implementation_kit/result_claim_badge.md",
      "purpose": "Copy-ready result claim badge and citation snippet."
    }
  ],
  "schema": "marked_bench.adoption-packet.v1",
  "standard_claims": {
    "implementation_kit_required": true,
    "leaderboard_review_required": true,
    "not_safety_certification": true,
    "public_result_card_required": true,
    "public_result_claim_required": true,
    "release_conformance_required": true,
    "same_suite_hash_required": true,
    "scoring_compatibility_required": true,
    "scoring_spec_required": true,